{
  "$schema": "./schema/plugin-repository.schema.json",
  "schemaVersion": 1,
  "id": "7c2f1a90-4b3e-4d8a-9c1b-2e5f6a7b8c9d",
  "description": "A Tempo plugin repository created from the official template.",
  "plugins": [
    {
      "id": "com.example.welcome",
      "path": "plugins/com.example.welcome"
    }
  ]
}
